{
  "schema": "ai_teaching_student_input/v2",
  "session_id": "TS-4242",
  "expected_revision": 9,
  "client_request_id": "cri-20260903-0002",
  "input": {
    "kind": "control",
    "command": "barge_in",
    "not_started_delivery": {
      "sequence_id": "PS-4242",
      "ordinal": 1,
      "action_id": "VA-visual-0001"
    }
  },
  "execution_owner": {
    "client_instance_id": "browser-visual-0001",
    "epoch": 1
  }
}
